Title,Period,Country,Classification,Description
Paintings after Ancient Masters: Volume 1,16th Century,China,Painting,"The twenty paintings in this double album by Chen Hongshou include landscapes, figures, and flowers. It also has one leaf featuring a woman, an often-used subject not found in the other albums from the latter part of his career. His late works are wonderful summations of Chen's peculiar and quirky art—archaistic, hyper-refined—but without accompanying shallowness or sentimentality.His figures and landscapes in the late albums are miniaturized, not unlike the small Chinese gardens, or the carefully selected small table rocks or old roots used for contemplation to see the world in miniature. This loss of scale is quite deliberate and reflects the psychological situation of a depressed class like the Ming loyalist officials and scholars, deprived of their integrity and honor, and forced to lead a diminished and restricted existence."
Plum Blossoms,18th Century,China,Painting,"A native of Anhui province, Wang Shishen was a professional painter who specialized in plum blossoms. He moved to Yangzhou in the late 1720s to seek patrons. Here, the daring composition of a flowering plum branch is balanced through the addition of four poems. Wang’s poems evoke nostalgia for the forgotten Six Dynasties period and the glorious Sui dynasty, during which the Grand Canal was built while Yangzhou was the southern capital of the empire. Other inscriptions in the upper part of the painting allude to the fact that Wang had developed blindness in one eye, probably at the time he conceived this painting."
"Queen Juliana Receives Visitors and Flowers on her Birthday, Soestdijk, Holland",20th Century,United States,Photograph,
Jaswant Singh of Jodhpur (reigned 1635–1678),17th Century,Null,Painting,"Mughal emperors forged alliances with the Hindu rulers of territories under their control by offering them positions of military authority within the Mughal court. Jaswant Singh, the raja (ruler) of Jodhpur, served as a military officer under the emperors Shah Jahan (reigned 1627–58) and Alamgir (also known as Aurangzeb; reigned 1658–1707). The flowering plants at the end of his sash became popular during the reign of Shah Jahan. His military accouterments include two swords and a stabbing dagger. The sensitive shading and mode of dress are closely based on Mughal styles, indicating Jodhpur’s close allegiance to the Mughal empire."
Zephyre and Flore,18th Century,France,Print,"Following the method of Bonnet, his mentor and colleague, Janinet created luxurious sets of color prints with printed gold frames and passed them off as foreign imports. Because the printmakers’ unauthorized use of gold leaf was eventually caught, only a limited number of gilded examples were produced. Impressions of these prints are scarce today, as many were ruined after being displayed in homes. This allegory of spring depicts Zephyre, the classical personification of the west wind, with his lover Flore, goddess of flowers"
Nagisa Palace from the Tales of Ise,19th Century,Japan,Painting,"This screen depicts an episode from the Tales of Ise, a 10th-century collection of poems and associated narratives in which the main character composes the following poem while drinking sake and viewing cherry blossoms: If, in this world of ours / All the cherry blossoms / Disappeared / The heart of spring / Might find peace.Our hero relaxes on a shoulder rest, gazing at the flowers, his sake dish before him on a lacquered stand. A plump boy attendant monitors the sake dishes, a ewer at the ready. An associate sits with paper, ink, and brush, poised to record poems."
Evening View of the Eight Famous Places near Kanazawa Under Full Moon in Musashi Province,19th Century,Japan,Print,"Late in his career, Hiroshige explored the poetic theme of setsugekka, “snow, moon, and flowers,” in a set of three triptychs. This panoramic scene shows the autumn moon over Kanazawa, near Tokyo. Hiroshige’s contemporaries would have recognized the coastline dotted with villages, fishing boats, and the distinctive double-arched bridge at the bottom right."
Dinner Service (Rousseau service): Flowers (no. 23),19th Century,France,Print,
Bowl,18th Century,Null,Ceramics,"Flowers in vivid colors including peonies, lilies, and chrysanthemums are set against a brilliant red enamel ground. The petals and veins of leaves are depicted in fine outlines and soft colors demonstrating the craftsman’s excellent painting skill. This porcelain exemplifies the technical perfection of Qing dynasty court artisans who surpassed their predecessors in technical skill. The bowl bears a mark on its base reading “Made for Emperor Yongzheng 雍正御製.” The Yongzheng emperor was one of the three early Qing emperors whose taste greatly influenced art production and collecting."
Embroidered Sash (Uckur),18th Century,Null,Embroidery,Each end of the sash is embroidered with a single motif of large-scale flowering plants. Below the main motif is a stylized foliate device forming a narrow border.
"History of the Ceramic Art: A Descriptive and Philosophical Study of the Pottery of All Ages and All Nations: China: Porcelain, Colored Upon Biscuit, Teapot, with Raised Handle.  Teacup in the form of a Flower (Plate II)",19th Century,France,Books,
Women Chasing Crickets on an Autumn Moor,18th Century,Japan,Print,"In the waning days of summer, autumn insects begin to sing, heralding the approach of autumn. The two courtesans and their servant chase crickets among flowering bush clover, one of the flowers of autumn. In the background ancient courtiers enjoy the same pastime. Note the plovers, or chidori, on the kimono of the woman on the left. These are shorebirds that migrate through Japan during the autumn and spring. Chidori in flight have been a favored theme of art and poetry for more than a thousand years in Japan."
"Radha Awaiting Reconciliation with Krishna, from a Gita Govinda of Jayadeva",17th Century,Null,Painting,"The artist has depicted Krishna’s favorite lover, Radha, six times to emphasize her agitation while she waits for Krishna. She has made intimate enclosures of flowering branches for their tryst, she pleads with a picture of him, and she lays out blossoms and liquor under a tree in preparation. Her confidante makes an appeal to Krishna who sits under a tree at right, seemingly unmoved and dispassionate. The viewer is meant to put oneself in the place of Radha, and feel her intense longing for Krishna. Even when it seems like the god does not come when he promises, that he does not care, the devotee, like Radha, should continue to wait and prepare to receive him."
Flowers of Evil (Les Fleurs du Mal),21st Century,Japan,Books,
Flowers of Evil (Les Fleurs du Mal),21st Century,Japan,Books,
"Woman selling flowers during revolution, Hungary",20th Century,Austria,Photograph,
Flowers of Evil (Les Fleurs du Mal),21st Century,Japan,Books,
Flowers of Evil (Les Fleurs du Mal),21st Century,Japan,Books,
"Sketchbook, Spain: Page 48, Studies of Flowers",20th Century,United States,Books,
"The Several Habits of English Women, from the Nobility to the Country Women as they are in these times:  The Woman with a Mannish Hat and Flowered Petticoat",17th Century,Czech Republic,Print,
Gunakali Ragini,18th Century,Null,Painting,"Paintings made in the city of Jaipur took on a confectionary palette that became popular among newly expanded markets around India and abroad. With the disintegration of centralized imperial power, the Rajput kingdom of Jaipur began independently producing art that had mass appeal. Sets of paintings by royal court artists, such as the Ragamala series from which this page came, were made for sale, rather than for the private collection of the king. The revenues from their sale ensured the prosperity of the kingdom. The verse associated with Gunakali Ragini, a wintertime raga, states that the heroine “sets mandara flowers in a golden jar and seated, plucks them, with her mind fixed on love’s sport.”"
Chasuble,17th Century,Null,Embroidery,"This rare chasuble decorated with angels, musicians, pomegranates, and flowers represents Sacred and Profane Love. This is indicated by two figures—a clear-sighted figure embracing a blindfolded figure—standing on a globe in the upper center and also by the musicians. The angels play soft-sounding instruments (harpsichords, harps, viole da barccio, and flutes) while earthy figures play loud instruments (tambours and hunting horns). The chasuble was most likely part of a liturgical set commissioned for a wedding. This entire chasuble is embroidered with silk and metal thread laid over linen and stitched in place. The exceptionally fine workmanship, lavish use of gold and silver, and brilliant silk thread create this sumptuous vestment."
"Nude Study, Girl Sitting on a Flowered Cushion",20th Century,United States,Print,
"Sketchbook No. 6, page 186: Pencil sketch of flowers",20th Century,United States,Books,
Flowers of Evil (Les Fleurs du Mal),21st Century,Japan,Books,
Flowers of Evil (Les Fleurs du Mal),21st Century,Japan,Books,
Bust of Mademoiselle Lender,19th Century,France,Print,"Toulouse-Lautrec made several portraits of the actress Marcelle Lender at the height of her stardom in 1895 when she was featured in the operetta Chilpéric--libretto and music by Hervé--performed at the Théâtre des Variétés in Paris. The artist attended the production on more than 20 occasions, arriving just in time to see the final bolero in which Lender’s multilayered skirts created an explosion of bright pink and green tulle as she danced. With the fuchsia flowers and green cape, Toulouse-Lautrec evoked the performance that helped win Lender acclaim."
Blessed Lord Buddha,19th Century,Null,Painting,"The central figure of the Buddha, radiating light and the flame of enlightenment, is flanked by his four main disciples: Sariputra and the blue Moggallana on his left, and Ananda and Anuruddha on his right. Below him is the earth goddess holding a pot of water on her head. To her right are three guardians of Sri Lanka: Kataragama (or Skanda) with six heads and twelve arms; the blue Vibhishana, younger brother of Ravana; and, smaller in size, may be Pattina holding an anklet and neem leaf. On the opposite side are three deities: Sumana, the four-faced Brahma, and four-armed Shiva with trident. Arranged around two depictions of the bodhi tree under which the Buddha reached enlightenment, rows of other monks bear garlands in veneration. Each of the standing protector divinities around the periphery grasps a bow and arrow.This painting evokes the appearance of 18th- to 19th-century murals in Sri Lankan Buddhist temple interiors, such as those at Dumbulla, with its rows of golden figures. It was probably part of a domestic shrine, along with small sculptures of the Buddha, palm-leaf manuscripts of Pali scriptures, incense, oil lamps, bells, and other offerings such as food, flowers, and water. The varnish that covers the painting may have been intended to shield it from the environment of an active place of worship."
Fragment,20th Century,Italy,Sculpture,"The Madonna sits upon a throne with the Christ Child standing on her knee.  He is steadied by his mother, turning delicately to grasp the Virgin's robe for support.  On the left is St. Francis, identified by his stigmata.  On the right, St. Anthony Abbot is identified by his monk's robe and T-shaped walking stick.  The brown robes of the saints, the purple of the Virgin's tunic (a shade characteristic of the artist), and the flesh tones of the figures contrast strongly against the bright blue background.  In the semicircular sky behind the figures, three winged cherub heads emerge, representing a host of angels.  
The inclusion of St. Francis in this altarpiece honors the saint, suggesting that the altarpiece may have been originally built into the wall of a Franciscan institution in Tuscany.  Two shields bearing the Borgherini family crest appear in the lower portion of the altarpiece's border, further suggesting that the chapel for which this altarpiece was made was likely owned or endowed by the family.  
Glazed terracotta is both durable and decorative and the gleaming white of this piece would have stood out in the darkness of a church.  The medium was made popular by Renaissance artist Luca della Robbia and came into fashion as a substitute for expensive carved marble.  A rounded arch frame embellished with fruit and flower garlands as well as egg-and-dart and cord moldings accompanied the work when it was acquired, but was later determined not to be original and removed.  Buglioni's work bears the influence of the della Robbias, particularly in the simple color scheme.  Buglioni likely worked in the studio of Luca's nephew, Andrea, where he would have learned the technique of glazing terracotta."
Fragment,20th Century,Italy,Sculpture,"The Madonna sits upon a throne with the Christ Child standing on her knee.  He is steadied by his mother, turning delicately to grasp the Virgin's robe for support.  On the left is St. Francis, identified by his stigmata.  On the right, St. Anthony Abbot is identified by his monk's robe and T-shaped walking stick.  The brown robes of the saints, the purple of the Virgin's tunic (a shade characteristic of the artist), and the flesh tones of the figures contrast strongly against the bright blue background.  In the semicircular sky behind the figures, three winged cherub heads emerge, representing a host of angels.  
The inclusion of St. Francis in this altarpiece honors the saint, suggesting that the altarpiece may have been originally built into the wall of a Franciscan institution in Tuscany.  Two shields bearing the Borgherini family crest appear in the lower portion of the altarpiece's border, further suggesting that the chapel for which this altarpiece was made was likely owned or endowed by the family.  
Glazed terracotta is both durable and decorative and the gleaming white of this piece would have stood out in the darkness of a church.  The medium was made popular by Renaissance artist Luca della Robbia and came into fashion as a substitute for expensive carved marble.  A rounded arch frame embellished with fruit and flower garlands as well as egg-and-dart and cord moldings accompanied the work when it was acquired, but was later determined not to be original and removed.  Buglioni's work bears the influence of the della Robbias, particularly in the simple color scheme.  Buglioni likely worked in the studio of Luca's nephew, Andrea, where he would have learned the technique of glazing terracotta."
Leaf Excised from a Book of Hours: Decorated Initial H,15th Century,Netherlands,Manuscript,"The difficulty in localizing Dutch manuscripts of the second half of the 15th century is formidable. Many shared or exchanged characteristics are found, particularly in terms of page layout, border decoration, and initial design. The present leaf contains borders embellished with brightly colored flowers (columbines) and acanthus leaves filled in with gold bezants, tiny green leaves, and little black dots. Though different in palette, these elements bear closest resemblance to borders and initials produced by a group of artists associated with the Zwolle Bible (Utrecht, Universiteitsbibliotheek, MS. 31). The original illuminators are believed to have worked within the Monastery of the Canons Regular at Agnietenberg. This leaf is painted in an associated style by an artist who must have been familiar with the Zwolle group."
Bottle-shaped Vase,18th Century,Null,Ceramics,"This spectacular vase, one of a pair in the collection, depicts flowering and fruiting peach trees to convey an auspicious message of affluence and long life. Developments in enamel technology led to new possibilities in polychrome decoration of Qing imperial porcelains. Pinks appeared, lending their name to the new palette of overglaze colors (famille rose), and the addition of opaque white allowed painters to vary the value of pigments, enhancing the painterly quality of porcelain decoration."
"History of the Ceramic Art: A Descriptive and Philosophical Study of the Pottery of All Ages and All Nations: China: Porcelain, Colored Upon Biscuit, Teapot, with Raised Handle.  Teacup in the form of a Flower (Plate II)",19th Century,France,Books,
Fragment,20th Century,Italy,Sculpture,"The Madonna sits upon a throne with the Christ Child standing on her knee.  He is steadied by his mother, turning delicately to grasp the Virgin's robe for support.  On the left is St. Francis, identified by his stigmata.  On the right, St. Anthony Abbot is identified by his monk's robe and T-shaped walking stick.  The brown robes of the saints, the purple of the Virgin's tunic (a shade characteristic of the artist), and the flesh tones of the figures contrast strongly against the bright blue background.  In the semicircular sky behind the figures, three winged cherub heads emerge, representing a host of angels.  
The inclusion of St. Francis in this altarpiece honors the saint, suggesting that the altarpiece may have been originally built into the wall of a Franciscan institution in Tuscany.  Two shields bearing the Borgherini family crest appear in the lower portion of the altarpiece's border, further suggesting that the chapel for which this altarpiece was made was likely owned or endowed by the family.  
Glazed terracotta is both durable and decorative and the gleaming white of this piece would have stood out in the darkness of a church.  The medium was made popular by Renaissance artist Luca della Robbia and came into fashion as a substitute for expensive carved marble.  A rounded arch frame embellished with fruit and flower garlands as well as egg-and-dart and cord moldings accompanied the work when it was acquired, but was later determined not to be original and removed.  Buglioni's work bears the influence of the della Robbias, particularly in the simple color scheme.  Buglioni likely worked in the studio of Luca's nephew, Andrea, where he would have learned the technique of glazing terracotta."
Pair of Boots,11th - 12th Century,Null,Garment,"The fabric and tailoring of garments have always defined social status. For these boots, different outer fabrics were used: a patterned silk for the leg portion, and tapestry (kesi) for the foot. Since both were considered luxury fabrics, they were pieced together from remnants too precious to discard. Consequently, the silk pattern was not used in relation to the form of the boot, as seen in some other imperial boots. By contrast, these boots would have been made for a court official, not a member of the imperial family. The patterned silk was woven with geese flanking a vase of flowers on a stand and surrounded by cloud scrolls. The Chinese motif of flowers arranged in a vase was adopted by the Liao during the 11th century and indicates an 11th- or early 12th-century date for the boots."
Queen of the May,19th Century,England,Photograph,"A major figure in the development of British photography, Cameron elevated the portrait to new artistic heights. She never opened a commercial studio or accepted commissions, but she was one of the first photographers to sell her photographs through a fine art gallery. Friends, neighbors, family, and servants were cajoled into modeling for portraits as themselves and as allegorical figures from history, religion, mythology, and literature. Little is known about Emily Peacock, who posed here as the protagonist in The May Queen by Britain’s poet laureate Alfred Tennyson. Typically crowned with flowers, the May Queen is selected as part of the celebrations on May 1, a traditional spring holiday in many cultures in the Northern Hemisphere."
Mountain and River on the Kiso Road,19th Century,Japan,Print,"Late in his career, Hiroshige explored the poetic theme of setsugekka, “snow, moon, and flowers,” in a set of three triptychs. This panoramic scene features a river passing snow-covered mountains along the Kiso Road."
"Nude Study, Girl Sitting on a Flowered Cushion",20th Century,United States,Print,
Flowers of Evil (Les Fleurs du Mal),21st Century,Japan,Books,
"Sketchbook, Spain: Inside Back Cover, Studies of Flowers",20th Century,Null,Books,
Boating in a Spring River,20th Century,China,Painting,This fan painting shows a charming scene of figures boating in a river framed by overhanging branches flowering in pink. The inscription states: “Today is the Dragon Boat Festival. This is painted to welcome my daughter Yishan home for a reunion. Inscribed by Baoshi in the early evening of 25 June 1963.” It is noteworthy that Fu Baoshi chose a joyful spring scene to express his delight about his daughter having returned home.
Flowers of Evil (Les Fleurs du Mal),21st Century,Japan,Books,
Flowers of Evil (Les Fleurs du Mal),21st Century,Japan,Books,
"Sketchbook, Spain: Page 48, Studies of Flowers",20th Century,United States,Books,
Snakeshead,20th Century,England,Textile,"When Morris designed Snakeshead in 1877, Indian silks were in style and widely imported from British India. This design stands out for its diminutive motifs and the strong red and black colors, which were fashionable only for a short time before paler hues regained favor with clients. While its color scheme suggests distant lands with warmer climates, the pattern showcases one of Morris’s favorite flowers: the fritillary, a wildflower that he remembered growing in the meadows near Oxford."
Dinner Service (Rousseau service): Flowers and Insects (no. 15),19th Century,France,Print,
Young Girl in Flowered Dress with Organdy Collar,20th Century,France,Print,
Flowers of Evil (Les Fleurs du Mal),21st Century,Japan,Books,
Fragment,20th Century,Italy,Sculpture,"The Madonna sits upon a throne with the Christ Child standing on her knee.  He is steadied by his mother, turning delicately to grasp the Virgin's robe for support.  On the left is St. Francis, identified by his stigmata.  On the right, St. Anthony Abbot is identified by his monk's robe and T-shaped walking stick.  The brown robes of the saints, the purple of the Virgin's tunic (a shade characteristic of the artist), and the flesh tones of the figures contrast strongly against the bright blue background.  In the semicircular sky behind the figures, three winged cherub heads emerge, representing a host of angels.  
The inclusion of St. Francis in this altarpiece honors the saint, suggesting that the altarpiece may have been originally built into the wall of a Franciscan institution in Tuscany.  Two shields bearing the Borgherini family crest appear in the lower portion of the altarpiece's border, further suggesting that the chapel for which this altarpiece was made was likely owned or endowed by the family.  
Glazed terracotta is both durable and decorative and the gleaming white of this piece would have stood out in the darkness of a church.  The medium was made popular by Renaissance artist Luca della Robbia and came into fashion as a substitute for expensive carved marble.  A rounded arch frame embellished with fruit and flower garlands as well as egg-and-dart and cord moldings accompanied the work when it was acquired, but was later determined not to be original and removed.  Buglioni's work bears the influence of the della Robbias, particularly in the simple color scheme.  Buglioni likely worked in the studio of Luca's nephew, Andrea, where he would have learned the technique of glazing terracotta."
Fragment,20th Century,Italy,Sculpture,"The Madonna sits upon a throne with the Christ Child standing on her knee.  He is steadied by his mother, turning delicately to grasp the Virgin's robe for support.  On the left is St. Francis, identified by his stigmata.  On the right, St. Anthony Abbot is identified by his monk's robe and T-shaped walking stick.  The brown robes of the saints, the purple of the Virgin's tunic (a shade characteristic of the artist), and the flesh tones of the figures contrast strongly against the bright blue background.  In the semicircular sky behind the figures, three winged cherub heads emerge, representing a host of angels.  
The inclusion of St. Francis in this altarpiece honors the saint, suggesting that the altarpiece may have been originally built into the wall of a Franciscan institution in Tuscany.  Two shields bearing the Borgherini family crest appear in the lower portion of the altarpiece's border, further suggesting that the chapel for which this altarpiece was made was likely owned or endowed by the family.  
Glazed terracotta is both durable and decorative and the gleaming white of this piece would have stood out in the darkness of a church.  The medium was made popular by Renaissance artist Luca della Robbia and came into fashion as a substitute for expensive carved marble.  A rounded arch frame embellished with fruit and flower garlands as well as egg-and-dart and cord moldings accompanied the work when it was acquired, but was later determined not to be original and removed.  Buglioni's work bears the influence of the della Robbias, particularly in the simple color scheme.  Buglioni likely worked in the studio of Luca's nephew, Andrea, where he would have learned the technique of glazing terracotta."
