Title,Period,Country,Classification,Description
Figure of a Gardener,18th Century,England,Ceramics,"Even though this figure and her counterpart (1945.37) are not accompanied by a sheep, these ceramic sculptures were sometimes known as “Garland Shepherds” during the mid-1700s. The name derived from a similar set produced by one of the Bow Porcelain Factory’s rivals, the Derby Porcelain Factory, in which the male figure holds a lamb. While these two factories often produced similar sets of pastoral, allegorical, biographical, and religious figures, the Bow Factory was known as one of the preeminent porcelain manufacturers, rivaled only by the Chelsea Porcelain Factory, with which Bow would later merge."
Figures Depicting the Four Seasons,18th Century,England,Ceramics,"In this group depicting the four seasons, a young boy in ice skates represents winter; a young lady adorns her hair with flowers in spring; a young man guards his beehive in summer; and a girl gathers fruit in autumn."
Shalabhanjika (Woman and Tree),4th - 5th Century,Null,Sculpture,"The full carving of a flowering tree on the back of this figurine indicates that she is a figure of a nature divinity who personifies the life-giving qualities of the sap that envigorates the tree and causes it to flower. These figures are sometimes called shalabhanjika, ""she who breaks the tree,"" probably because her fertile properties are so powerful that it causes the tree to fruit so heavily that the branches break."
Stand-in Fugen,18th - 19th Century,Japan,Painting,"Here, a woman dressed as a man replaces Fugen, a bodhisattva—a being among those considered enlightened in Buddhism—who symbolizes learning as a path to awakening and typically rides an elephant. The painting teaches the lesson of impermanence through the petals falling from the lotus flower the woman holds. It also alludes to the legend of Eguchi, a 12th-century courtesan who, following an encounter with a Buddhist monk-poet called Saigyō, revealed herself to be a manifestation of Fugen."
Water-Moon Kannon (Suigetsu Kannon),19th - 20th Century,Null,Painting,"Kannon represents a primary figure of benevolence and compassion in the Buddhist pantheon. Identified early in Buddhist texts as a close attendant to the Buddha, by the 700s Kannon's popularity soared to such an extent in China, Korea, and Japan that the bodhisattva was often worshipped independently. Here at the lower left, Kannon is depicted with the child Zenzai Dōji (Sakskrit: Sudhana), a wealthy boy who, according to the final chapter of the Flower Garland Sutra, visited Kannon's abode Fudaraka (Sanskrit: Potalaka) during a long journey to learn the bodhisattva path."
Flora [II],20th Century,Austria,Textile,"Also affectionately called Pepi’s Flora after Josef Frank’s childhood nickname “Pepi,” this design depicts imaginary wildflowers concocted by Frank. The whimsically placed yet tightly packed flowers are meant to evoke flowers in the background as well as the borders of French tapestries."
In Praise of Verse: Autumnal Equinox Buddist Service: Manjusaka Flowers,20th Century,Japan,Print,"An ardent Zen Buddhist, Munakata frequently portrayed Buddhist themes in his prints. His style was inspired in part by the direct and simple imagery of popular medieval Buddhist prints and 18th-century Japanese folk paintings."
Icon of the Virgin and Child,6th Century,Null,Textile,"This tapestry glorifying the Virgin Mary is among the rarest objects in the museum’s collection. In a composition borrowed from imperial Byzantine art, Mary is shown seated on a jeweled throne with the Christ child and flanked by archangels Michael and Gabriel. Above, Christ appears in a radiant light supported by two angels. Portraits of the apostles, identified in Greek, appear in the surrounding wreath symbolizing eternal life. This portable sacred textile was presumably displayed at the front of a public or private place of worship. This unique tapestry is one of the earliest Christian icons to survive. Woven icons were among the miraculous works shown to pilgrims in Jerusalem according to Abbot Adomnan of Iona (about 624–704) who described a linen cloth ""said to have been woven by Saint Mary, and is for this reason preserved in a church and venerated by the whole population. Pictures of the twelve apostles are woven into it, and there is also a portrait of the Lord."" The abbot’s description of the woven icon suggests it must have been similar to the tapestry displayed here. The delicate effects of shading in the facial features, garments, and vegetation were achieved by weaving the panel sideways with at least 20 colors, just as medieval tapestry weavers did centuries later in Europe. The high cost of dyes caused this majestic icon to be far costlier than painted images."
Seated Buddha,12th Century,Null,Lacquer,"This rare image of the historical Buddha Shakyamuni is shown seated with crossed legs in the position of meditation. His left hand rests on his lap, referring to his meditation under the Bodhi tree, and his right hand is in the earth-touching gesture—calling the earth to witness his enlightenment. The Buddha sits on a double lotus pedestal that indicates the presence of a transcendent being. The sculptural style is typical of sculptures made at the Buddhist site of Pagan. Sculptures such as this were installed in niches in an interior passage of a temple. As is typical of Burmese works, this sculpture was carved from a solid piece of wood. Its surface was covered in black lacquer and then gilded; a great deal of the gilding remains intact. Because lacquer is an easily perishable material, works of this type and size are exceedingly rare; this sculpture is one of the best extant examples."
Maharana Jagat Singh Attending the Raslila,18th Century,India,Painting,"To celebrate the New Year festival of Diwali, dancers reenact the life story of the Hindu god Krishna in a palace courtyard by candlelight under the full moon. The king, a vassal of the Mughal emperor, sits with the halo of divine sanction for his rule at the left of the courtyard, smoking from a golden goat-shaped hookah, with his young son and heir at his side. At the top of the composition, a dancer dressed in blue with a peacock-feather crown plays the part of Krishna. In the upper right corner, a canopy painted with swirling storm clouds stands for the rainstorm sent by the jealous king of the gods, who is shown in the middle of the canopy with his consort and mount, the elephant with seven trunks. Guards and grooms in the foreground entertain themselves with music while they wait with the horses of visiting nobles. The formal geometric gardens, playful use of perspective, and individualized portraiture indicate the selective adoption of the styles and sensibilities of the imperial Mughal court in the paintings from this large-format series."
Octafoil Mirror with Two Immortals Crossing the Ocean,10th – 13th Century,Null,Metalwork,"This mirror in the shape of a flower represents two immortals crossing the ocean, surrounded by surging waves. The younger figure on the left wears two buns on his head; the elder one with a long beard is carrying a musical instrument, sheng. The scene may illustrate “The Eight Immortals Crossing the Ocean,” in which their supernatural power to walk on water is depicted. The two men here stand on their swords to travel on water. In Daoist and Buddhist thinking, swords are considered powerful, magical implements to exorcise demons and destroy evil spirits."
New Suite of Portfolios of Flowers Ideal to Use for Designing and Painting: Floral Fantasies,18th Century,England,Print,"As a painter and decorative artist,Jean Baptiste Pillement ornamented a broad range of objects including ceramics, textiles, and other household objects. He employed several printmakers to copy his designs that were then disseminated throughout Europe. The best of the printmakers, Anne Allen, colored the etched plate à la poupée. Instead of making a plate for each color, a single plate is selectively inked in different colors using stumps of rags, known as dolls (poupée in French), so that the complete design is printed at one time."
Black and White Lilies III,20th Century,United States,Photograph,"In the early 1920s, Cunningham combined the clarity and directness of modernism with her long-held interest in botanical imagery. For two decades she created a remarkable group of close-up studies of plants and flowers that identified her as one of the most sophisticated and experimental photographers working in America. In this dramatic, tightly cropped composition, Cunningham isolated two lilies against a simple velvet backdrop. A black calla (arum palaestium) was rhythmically placed in front of a white calla (zantedeschia aethiopica). The expanded scale of the black flower, with its partially visible spadix diagonally positioned, dominates the picture. The sculptural shapes and rich textures were emphasized by the combination of daylight and blue tungsten photofloods and the copious detail provided by the 8x10-inch negative. This sensuous print also encompasses a luxurious range of tones, from velvety black to milky white."
Plate from Dessert Service: Chinese Ixia,19th Century,England,Ceramics,"Each dish is decorated with recognizable plants, the names of which are inscribed on the base in both Latin and English. Identifying the blossoms only became customary in the late 18th century when a single piece of porcelain was decorated with one species, and flowers were represented along with leaves, stems, seed pods, and roots. All of this reflects Carolus Linnaeus’s recent invention of a scientific method to categorize all known flora. The decorations on the Derby factory’s products derive from contemporary English botanical publications. For instance, illustrations in William Curtis’s The Botanical Magazine served as models for the French marigold and nettle leaved bell flower on the dessert service."
Wine Flowers,20th Century,United States,Sculpture,
Mirror,13th - 14th Century,Null,Metalwork,"The Japanese used chrysanthemums as decorative elements on mirrors. In the Heian period, a chrysanthemum with cranes or long-tailed birds was a common motif. Later, in the Kamakura and Muromachi periods, chrysanthemum designs were divided into three patterns with different symbolic associations: Chrysanthemum with Cranes represented longevity; Water Flowing suggested longevity as well as the Noh drama Kikujido, or Chrysanthemum Boy; and East Fence alluded to the poem ""Drinking Wine"" by Tao Yuanming (AD 365-427). Here, the mirror featuring Buddhist iconography (kyojo) and a chrysanthemum design on the back shows that the flower was also appreciated in the context of Buddhism in the Kamakura period."
"Flowers of a Hundred Worlds (Momoyogusa), vols. 1–3",20th Century,Japan,Books,"This set of three woodblock printed folding-books displays the graphic design prowess of Kamisaka Sekka. The images were first distributed one by one to subscribers to the series but later were reissued in bound form, like these books, for mass consumers. Each print features a vignette taken from nature or Japanese literature. Many of the scenes have a long history in Japan, originating in the 900s or 1000s and having been interpreted by all manner of artists since that time. Sekka’s selections hew closely to precedents from the Rinpa style originated by painter Tawaraya Sōtatsu (c. 1570–c. 1640) and calligrapher Hon’ami Kōetsu (1558–1637)."
Dish,17th Century,England,Silver,"Silver fulfilled a prominent role in projecting wealth, status, power, and ritual in British life during the 1600s and 1700s. Elaborate forms such this shallow dish not only represented wealth in its sheer silver weight but also provided royal and aristocratic owners a surface for displaying engraved coats of arms. For example, this dish is engraved with the arms of Sir Charles Holte (1648–1722), the 3rd Baronet of Warwickshire, and his wife Anne Clobery (1664–c. 1738) of Bradstone, Hampshire, along the southern coast of England."
Mirror with Pair of Cranes in Chrysanthemum Pattern,14th - 16th Century,Null,Metalwork,"The Japanese used chrysanthemums as decorative elements on mirrors. In the Heian period, a chrysanthemum with cranes or long-tailed birds was a common motif. Later, in the Kamakura and Muromachi periods, chrysanthemum designs were divided into three patterns with different symbolic associations: Chrysanthemum with Cranes represented longevity; Water Flowing suggested longevity as well as the Noh drama Kikujido, or Chrysanthemum Boy; and East Fence alluded to the poem ""Drinking Wine"" by Tao Yuanming (AD 365-427). Here, the mirror featuring Buddhist iconography (kyojo) and a chrysanthemum design on the back shows that the flower was also appreciated in the context of Buddhism in the Kamakura period."
Lily of the Valley Comb,20th Century,France,Jewelry,"This comb was purchased by Cleveland native Jeptha Homer Wade II from Lalique after admiring the designer's work at the 1900 Exposition Universelle in Paris, probably for his wife Ellen Garretson Wade. Pearlescent horn forms the leaves of the lily of the valley, out of which the delicate, bell-shaped enamel flowers emerge."
The Botanical Magazine or Flower Garden Displayed:  Star of Bethlehem,18th Century,England,Print,
The Botanical Magazine or Flower Garden Displayed:  Garden Hyacinth,19th Century,England,Print,
New Suite of Portfolios of Flowers Ideal to Use for Designing and Painting: Floral Fantasies,18th Century,France,Print,"As a painter and decorative artist,Jean Baptiste Pillement ornamented a broad range of objects including ceramics, textiles, and other household objects. He employed several printmakers to copy his designs that were then disseminated throughout Europe. The best of the printmakers, Anne Allen, colored the etched plate à la poupée. Instead of making a plate for each color, a single plate is selectively inked in different colors using stumps of rags, known as dolls (poupée in French), so that the complete design is printed at one time."
Mirror with Pair of Cranes in Chrysanthemum,15th - 16th Century,Null,Metalwork,"The Japanese used chrysanthemums as decorative elements on mirrors. In the Heian period, a chrysanthemum with cranes or long-tailed birds was a common motif. Later, in the Kamakura and Muromachi periods, chrysanthemum designs were divided into three patterns with different symbolic associations: Chrysanthemum with Cranes represented longevity; Water Flowing suggested longevity as well as the Noh drama Kikujido, or Chrysanthemum Boy; and East Fence alluded to the poem ""Drinking Wine"" by Tao Yuanming (AD 365-427). Here, the mirror featuring Buddhist iconography (kyojo) and a chrysanthemum design on the back shows that the flower was also appreciated in the context of Buddhism in the Kamakura period."
Mirror with Pair of Birds and Chrysanthemum Pattern,14th - 16th Century,Null,Metalwork,"The Japanese used chrysanthemums as decorative elements on mirrors. In the Heian period, a chrysanthemum with cranes or long-tailed birds was a common motif. Later, in the Kamakura and Muromachi periods, chrysanthemum designs were divided into three patterns with different symbolic associations: Chrysanthemum with Cranes represented longevity; Water Flowing suggested longevity as well as the Noh drama Kikujido, or Chrysanthemum Boy; and East Fence alluded to the poem ""Drinking Wine"" by Tao Yuanming (AD 365-427). Here, the mirror featuring Buddhist iconography (kyojo) and a chrysanthemum design on the back shows that the flower was also appreciated in the context of Buddhism in the Kamakura period."
Flowers and Birds,14th Century,China,Painting,
Nine Celestial Bodies (Navagraha),8th Century,Null,Sculpture,"Near temple entrances, the nine celestial bodies were depicted in an orderly row, often in figural form. From left to right they are: Sun with a tall crown and the female Dawn in front of him. The next five figures are nearly identical: Moon, Mercury, Venus, Mars, and Jupiter. As a portent of doom, Saturn was wounded by a goddess to prevent him from moving swiftly, so he stands on one leg. The bodiless head is Rahu, the eclipse, who swallows the moon until it falls out his neck. The serpent-tailed figure is a comet."
Mirror with Paulownia Crests,14th - 16th Century,Null,Metalwork,"The Japanese used chrysanthemums as decorative elements on mirrors. In the Heian period, a chrysanthemum with cranes or long-tailed birds was a common motif. Later, in the Kamakura and Muromachi periods, chrysanthemum designs were divided into three patterns with different symbolic associations: Chrysanthemum with Cranes represented longevity; Water Flowing suggested longevity as well as the Noh drama Kikujido, or Chrysanthemum Boy; and East Fence alluded to the poem ""Drinking Wine"" by Tao Yuanming (AD 365-427). Here, the mirror featuring Buddhist iconography (kyojo) and a chrysanthemum design on the back shows that the flower was also appreciated in the context of Buddhism in the Kamakura period."
New Suite of Portfolios of Flowers Ideal to Use for Designing and Painting: Floral Fantasies,18th Century,England,Print,"As a painter and decorative artist,Jean Baptiste Pillement ornamented a broad range of objects including ceramics, textiles, and other household objects. He employed several printmakers to copy his designs that were then disseminated throughout Europe. The best of the printmakers, Anne Allen, colored the etched plate à la poupée. Instead of making a plate for each color, a single plate is selectively inked in different colors using stumps of rags, known as dolls (poupée in French), so that the complete design is printed at one time."
"Marigolds, single Anemone, Jasmine...",17th Century,France,Print,"In 1939 the Print Club of Cleveland established a memorial collection for Donald Gray, president of the Club 1933–34. Since Mr. Gray was a landscape architect and author of the “Daily Garden” column for The Cleveland Press, a now defunct newspaper, the choice of 15 prints and one drawing of flower and fruit subjects was an appropriate tribute. These were the first botanical prints to enter the collection, which has grown to a large representation of more than 100 prints and related drawings."
The force that through the green fuse drives the flower,20th Century,England,Print,
Fruits and Flowers,20th Century,United States,Painting,
Plate from Dessert Service: Hollyhock,19th Century,England,Ceramics,"Each dish is decorated with recognizable plants, the names of which are inscribed on the base in both Latin and English. Identifying the blossoms only became customary in the late 18th century when a single piece of porcelain was decorated with one species, and flowers were represented along with leaves, stems, seed pods, and roots. All of this reflects Carolus Linnaeus’s recent invention of a scientific method to categorize all known flora. The decorations on the Derby factory’s products derive from contemporary English botanical publications. For instance, illustrations in William Curtis’s The Botanical Magazine served as models for the French marigold and nettle-leaved bell flower on the dessert service."
Plate from Dessert Service: French Marigold,19th Century,England,Ceramics,"Each dish is decorated with recognizable plants, the names of which are inscribed on the base in both Latin and English. Identifying the blossoms only became customary in the late 18th century when a single piece of porcelain was decorated with one species, and flowers were represented along with leaves, stems, seed pods, and roots. All of this reflects Carolus Linnaeus’s recent invention of a scientific method to categorize all known flora. The decorations on the Derby factory’s products derive from contemporary English botanical publications. For instance, illustrations in William Curtis’s The Botanical Magazine served as models for the French marigold and nettle-leaved bell flower on the dessert service."
Square Tile-Squirrel with Long Ears Holding Flower,20th Century,Null,Ceramics,
The Botanical Magazine or Flower Garden Displayed:  Stately Crinum,19th Century,England,Print,
The force that through the green fuse drives the flower,20th Century,England,Print,
Untitled (Wild Flowers and Rock),20th Century,United States,Photograph,
Standing Buddha,9th Century,Null,Sculpture,"This small sculpture was probably part of a set of eight main scenes from the life of the Buddha, each identified by a specific hand gesture. When the standing Buddha gestures down with his right hand, with the palm facing out, he usually signals his miraculous descent from the Heaven of the Thirty-three Gods, where he once spent a monsoon season giving teachings to his mother. She died shortly after his birth and was reborn in the heaven."
Dragon in foliage with lion and phoenix heads,16th Century,Turkey,Drawing,"A dragon lunges toward a pearl in the form of a seal inscribed with a verse from the Koran: “And I commit my case unto God” (40:44). In his front claw, the dragon grasps two flowering branches that magically produce a variety of blooms, including a lion that bites the dragon’s neck and a phoenix, who competes for the pearl. Sahkulu was trained by Persian artists, as were many artists of Mughal India during the 1500s. He joined the Ottoman imperial painting atelier in Istanbul in 1526 and became the head in 1545."
Quatrelobed Dish from Dessert Service: Lily of the Valley,19th Century,England,Ceramics,"Each dish is decorated with recognizable plants, the names of which are inscribed on the base in both Latin and English. Identifying the blossoms only became customary in the late 18th century when a single piece of porcelain was decorated with one species, and flowers were represented along with leaves, stems, seed pods, and roots. All of this reflects Carolus Linnaeus’s recent invention of a scientific method to categorize all known flora. The decorations on the Derby factory’s products derive from contemporary English botanical publications. For instance, illustrations in William Curtis’s The Botanical Magazine served as models for the French marigold and nettle-leaved bell flower on the dessert service."
"Untitled (Masked Figure, Flowers and Candles, Mexico)",20th Century,United States,Photograph,"A social documentary photographer, Debbie Fleming Caffery is known for her extended bodies of work including photographs of rural Louisiana's sugarcane workers and her most recent images which record the markets, festivals, and rituals of Mexico.  Conveying a sense of mystery and spirituality, she obscures the specific identity of the figure in Untitled, who participates in the Day of the Dead festival, through a combination of high-contrast lighting and long shutter speeds."
Bowl: Bright Flowers,20th Century,United States,Enamel,
Plate from Dessert Service: Polyanthus,19th Century,England,Ceramics,"Each dish is decorated with recognizable plants, the names of which are inscribed on the base in both Latin and English. Identifying the blossoms only became customary in the late 18th century when a single piece of porcelain was decorated with one species, and flowers were represented along with leaves, stems, seed pods, and roots. All of this reflects Carolus Linnaeus’s recent invention of a scientific method to categorize all known flora. The decorations on the Derby factory’s products derive from contemporary English botanical publications. For instance, illustrations in William Curtis’s The Botanical Magazine served as models for the French marigold and nettle-leaved bell flower on the dessert service."
The force that through the green fuse drives the flower,20th Century,England,Print,
Sparrows and Bamboo,16th Century,Japan,Painting,"Shiken Saidō, whose style name was Ze'an, was a Zen monk who trained at Shōkokuji temple in Kyoto, and designed the garden of Reiun’in at Myōshinji temple. He painted landscapes in the style of painter and art advisor to the shogun, Sōami (died 1525), as well as bird-and-flower compositions. A poetic inscription by the monk Ekkei Reikaku accompanies this gentle composition of two sparrows perched on bamboo."
"The Temple of Flora, or Garden of Nature:  A Group of Auriculas",19th Century,England,Print,"The greatest English botanical publication of the early 19th century was Dr. Robert John Thornton’s Temple of Flora. Although Thornton studied medicine, his passion was botany and he soon embarked upon a major publishing venture that brought him both fame and financial ruin. The work, New Illustrations of the Sexual System of Linnaeus, was the most sumptuous botanical publication ever produced. The third section, the famous Temple of Flora, has 28 flower portraits set not against a plain conventional background but in the full richness of their natural setting. Unfortunately the day of the great florilegia had passed and Thornton died in poverty in 1837."
Mirror with Pair of Birds in Chrysanthemum,14th - 16th Century,Null,Metalwork,"The Japanese used chrysanthemums as decorative elements on mirrors. In the Heian period, a chrysanthemum with cranes or long-tailed birds was a common motif. Later, in the Kamakura and Muromachi periods, chrysanthemum designs were divided into three patterns with different symbolic associations: Chrysanthemum with Cranes represented longevity; Water Flowing suggested longevity as well as the Noh drama Kikujido, or Chrysanthemum Boy; and East Fence alluded to the poem ""Drinking Wine"" by Tao Yuanming (AD 365–427). Here, the mirror featuring Buddhist iconography (kyojo) and a chrysanthemum design on the back shows that the flower was also appreciated in the context of Buddhism in the Kamakura period."
